id,name,category,symptoms,causes,lifestyle,diet,recommendedFoods,avoidFoods,warning
diabetes,당뇨,대사 질환,갈증 증가;잦은 소변;피로감;상처 회복 지연,인슐린 분비 또는 작용의 문제;유전적 요인;체중 증가;운동 부족,규칙적인 식사 시간을 유지합니다.;가벼운 유산소 운동을 꾸준히 시도합니다.;혈당 변화와 컨디션을 기록합니다.,정제 탄수화물보다 통곡물을 선택하면 도움이 될 수 있습니다.;채소와 단백질을 함께 구성하는 식사가 권장됩니다.,통곡물;채소;견과류;콩류;무가당 요거트,설탕;과자;단 음료;정제 탄수화물 과다 섭취,혈당 조절과 약물 사용은 반드시 의료진과 상담하세요.
hypertension,고혈압,심혈관 질환,두통;어지러움;가슴 답답함;대부분 무증상,나트륨 과다 섭취;스트레스;가족력;비만;운동 부족,혈압을 일정한 시간에 측정합니다.;짠 음식과 가공식품 섭취를 줄입니다.;수면과 스트레스 관리를 병행합니다.,저염식은 혈압 관리에 도움이 될 수 있습니다.;칼륨이 풍부한 식품은 개인 상태에 따라 도움이 될 수 있습니다.,저염식;칼륨이 풍부한 채소;과일;등푸른 생선;잡곡,짠 음식;가공식품;라면 국물;젓갈류,신장 질환이 있으면 칼륨 섭취는 반드시 의료진과 상의해야 합니다.
gastritis,위염,소화기 질환,속쓰림;상복부 통증;더부룩함;메스꺼움,자극적인 음식;음주;스트레스;헬리코박터 감염 가능성;진통소염제 사용,과식과 야식을 줄입니다.;증상을 유발하는 음식을 기록합니다.;통증이 반복되면 진료를 받습니다.,부드러운 음식과 자극이 적은 식사가 도움이 될 수 있습니다.;카페인과 술은 주의가 필요합니다.,부드러운 음식;양배추;미음;죽;따뜻한 물,매운 음식;술;커피;튀김;야식,복통이나 구토가 반복되면 소화기내과 진료를 권장합니다.
arthritis,관절염,근골격계 질환,관절 통증;붓기;뻣뻣함;움직임 제한,퇴행성 변화;자가면역 반응;과사용;체중 부담;부상,무리하지 않는 범위의 스트레칭을 유지합니다.;관절에 부담을 줄이는 운동을 선택합니다.;통증과 부기가 심하면 진료가 필요합니다.,균형 잡힌 단백질 섭취가 도움이 될 수 있습니다.;체중 관리를 돕는 식사 구성이 중요할 수 있습니다.,생선;두부;콩류;채소;올리브오일,과도한 음주;당분이 많은 간식;고열량 가공식품,통증과 부기가 심하거나 열감이 있으면 진료가 필요합니다.
insomnia,불면증,정신건강 / 수면,입면 어려움;중간 각성;이른 기상;낮 피로감,스트레스;카페인;불규칙한 수면 시간;빛 노출;불안,매일 비슷한 시간에 일어납니다.;잠들기 전 화면 노출을 줄입니다.;카페인은 오후 늦게 피하는 것이 좋습니다.,저녁 과식과 음주는 수면에 방해가 될 수 있어 주의가 필요합니다.;따뜻한 무카페인 음료가 긴장 완화에 도움이 될 수 있습니다.,무카페인 허브차;바나나;견과류;따뜻한 우유,저녁 카페인;음주;야식;과식,불면이 오래 지속되면 수면클리닉 또는 정신건강의학과 상담을 권장합니다.
reflux,역류성 식도염,소화기 질환,속쓰림;신물 역류;목 이물감;마른기침,하부식도괄약근 약화;과식;야식;비만;카페인과 음주,식후 바로 눕지 않습니다.;야식과 과식을 줄입니다.;증상이 반복되면 소화기내과 상담을 고려합니다.,기름진 음식과 카페인은 주의가 필요합니다.;소량씩 천천히 먹는 습관이 도움이 될 수 있습니다.,오트밀;바나나;삶은 채소;기름기 적은 단백질,커피;초콜릿;기름진 음식;탄산음료;야식,가슴 통증이나 삼킴 곤란이 있으면 즉시 전문 진료가 필요합니다.
